{"accepted_taxon_key":"gbif:1938069","artifacts":[{"availability":"available","byte_size":513562,"logical_name":"baseline_geographic_spread","media_type":"application/vnd.apache.parquet","path":"demo/source/biominer_phase14/baseline_geography/taxon_geographic_spread.parquet","rights_id":"biominer-mit-metadata","row_count":16678,"schema_version":"taxon-geographic-spread-v1.0.0","sha256":"46f38228cb5e7ba58f5f38f79a38dd87ae8fab80cf987e916f620d5cc4b9e83c","snapshot_id":"gbif-occurrence-search-20260715","source_commit":"247b42f3206d48bb79e2dbf97c5a92e4f207ae71","source_repository":"karikris/BioMiner","unavailable_reason":null},{"availability":"available","byte_size":3343827,"logical_name":"baseline_occurrence_union","media_type":"application/vnd.apache.parquet","path":"demo/source/biominer_phase14/baseline_provider_union/baseline_occurrence_union.parquet","rights_id":"taxalens-mit-fixture","row_count":57603,"schema_version":"taxalens-baseline-occurrence-union:v1.0.0","sha256":"242e280b78a75b79dffb2012d24163d7ce62d07eeac908a31f55510afc486445","snapshot_id":"gbif-occurrence-search-20260715","source_commit":"cdee00c9e16e349d722733cd951709abce8d0fee","source_repository":"karikris/taxalens","unavailable_reason":null},{"availability":"available","byte_size":941398,"logical_name":"flickr_geography","media_type":"application/vnd.apache.parquet","path":"demo/source/biominer_phase14/flickr_geography/flickr_geography_verification.parquet","rights_id":"biominer-mit-metadata","row_count":40503,"schema_version":"taxalens-flickr-geography-verification:v1.0.0","sha256":"c414d2db442acc372029a4cc6d0a02d57a7f4e8495efd93ef2faa2499c32084d","snapshot_id":"flickr:2026-07-15","source_commit":"75461d9c065af0cd96b41cd1f845c2e920f7ae34","source_repository":"karikris/BioMiner","unavailable_reason":null},{"availability":"available","byte_size":313,"logical_name":"verification_consensus","media_type":"application/json","path":"demo/repository_storage/supabase/verification_consensus.json","rights_id":"taxalens-mit-fixture","row_count":0,"schema_version":"taxalens-repository-supabase-table:v1.0.0","sha256":"358afaf053c095b275e6189632fd22b4bd10b266953d57fd40e606163e194e0f","snapshot_id":null,"source_commit":"e85b0d225cfdad4932de95d745b936ae85a61097","source_repository":"karikris/taxalens","unavailable_reason":null},{"availability":"unavailable","byte_size":null,"logical_name":"quality_snapshot","media_type":null,"path":null,"rights_id":null,"row_count":null,"schema_version":null,"sha256":null,"snapshot_id":null,"source_commit":null,"source_repository":null,"unavailable_reason":"No retained human outcomes support a geographic quality snapshot; the repository mirror contains an explicit empty quality-snapshot table contract."},{"availability":"available","byte_size":299,"logical_name":"release_decisions","media_type":"application/json","path":"demo/source/verification/occurrence_release_decisions.json","rights_id":"taxalens-mit-fixture","row_count":0,"schema_version":"taxalens-occurrence-release-decisions:v1.0.0","sha256":"3cc571646b54b66b301edb3427d925f7bcf3f330ece57021b945d430a5164c19","snapshot_id":null,"source_commit":"ffef38ec4abc289d31011f8c74b762524c0caeec","source_repository":"karikris/taxalens","unavailable_reason":null},{"availability":"available","byte_size":559441,"logical_name":"geographic_impact_cells","media_type":"application/vnd.apache.parquet","path":"demo/source/biominer_phase14/geographic_impact/geographic_impact_cells.parquet","rights_id":"taxalens-mit-fixture","row_count":20237,"schema_version":"taxalens-geographic-impact-cell:v1.0.0","sha256":"97b2422657d79bc8e682c4e51358c0316f6c942a31fea9ed608ef2c4ba420d94","snapshot_id":null,"source_commit":"ffef38ec4abc289d31011f8c74b762524c0caeec","source_repository":"karikris/taxalens","unavailable_reason":null},{"availability":"available","byte_size":38351,"logical_name":"geographic_impact_summary","media_type":"application/vnd.apache.parquet","path":"demo/source/biominer_phase14/geographic_impact/geographic_impact_summary.parquet","rights_id":"taxalens-mit-fixture","row_count":385,"schema_version":"taxalens-geographic-impact-summary:v1.0.0","sha256":"056b0a05b5b82f4a00d20ba701275b1050e102ea58a5440cf4471235f14310cf","snapshot_id":null,"source_commit":"b399cd4fe92640ad9a219142f8a77ac2122e632e","source_repository":"karikris/taxalens","unavailable_reason":null},{"availability":"available","byte_size":102491,"logical_name":"country_hierarchy","media_type":"application/json","path":"demo/source/geography/country_hierarchy.json","rights_id":"natural-earth-public-domain-boundaries","row_count":183,"schema_version":"taxalens-country-hierarchy:v1.0.0","sha256":"f7181eff58f5d68cf0c9987c320b10bb4d9e22220f45af30e33f4de4cb198a54","snapshot_id":null,"source_commit":"6b2eb94d8998ce07d4ebd93e1613fcb0126dd0c0","source_repository":"karikris/taxalens","unavailable_reason":null}],"baseline_evidence_status":"available","baseline_only_cell_count":693,"baseline_snapshot_id":"gbif-occurrence-search-20260715","baseline_union_count":19201,"candidate_only_cell_count":6764,"country_hierarchy_id":"country-hierarchy:natural-earth-v5.1.2-110m","created_at":"2026-07-17T12:11:22Z","deterministic_fingerprint_sha256":"7f6d74f020db6cc4b4ba93dd0284b399a58163f49af1e9186ce45585feba40d3","direct_inaturalist_delta_count":null,"direct_inaturalist_delta_status":"unavailable","flickr_candidate_count":13501,"flickr_snapshot_id":"flickr:2026-07-15","generated_by":"taxalens-geographic-impact-builder:v1.0.0","geographic_impact_build_id":"geographic-impact:84b8d1b69c3dae1e329a3f6b","geographically_supported_flickr_candidate_count":13416,"geographically_unsupported_flickr_candidate_count":85,"hierarchy_node_count":183,"impact_cell_count":20237,"manifest_id":"geographic-impact-manifest:7f6d74f020db6cc4b4ba93dd","matched_cell_count":183,"media_failure_count":0,"pending_count":13501,"project_id":"taxalens-papilio-demoleus-judge-replay","provider_union_policy_version":"baseline-provider-union-policy-v1.0.0","registry_version":"butterflies-v2-20260712","release_policy_version":"occurrence-release-policy:v1.0.0","release_ready_additional_cell_count":0,"release_ready_count":0,"reviewed_additional_cell_count":0,"reviewed_negative_count":0,"reviewed_positive_count":0,"run_id":"papilio-demoleus-pilot-20260715","schema_version":"taxalens-geographic-impact-manifest:v1.0.0","scientific_name":"Papilio demoleus","skipped_count":0,"source_commits":[{"commit_sha":"247b42f3206d48bb79e2dbf97c5a92e4f207ae71","repository":"karikris/BioMiner"},{"commit_sha":"75461d9c065af0cd96b41cd1f845c2e920f7ae34","repository":"karikris/BioMiner"},{"commit_sha":"6b2eb94d8998ce07d4ebd93e1613fcb0126dd0c0","repository":"karikris/taxalens"},{"commit_sha":"b399cd4fe92640ad9a219142f8a77ac2122e632e","repository":"karikris/taxalens"},{"commit_sha":"cdee00c9e16e349d722733cd951709abce8d0fee","repository":"karikris/taxalens"},{"commit_sha":"e85b0d225cfdad4932de95d745b936ae85a61097","repository":"karikris/taxalens"},{"commit_sha":"ffef38ec4abc289d31011f8c74b762524c0caeec","repository":"karikris/taxalens"}],"spatial_resolutions":[3,5,7],"summary_row_count":385,"summary_scope_levels":["global","continent","country","admin1"],"unassigned_cartographic_cell_count":2160,"uncertain_count":0,"verification_projection_version":"taxalens-flickr-geography-verification:v1.0.0"}
